ticker,name,description,industry,currency,exchange,type,market_cap,market_cap_usd
A,"AGILENT TECHNOLOGIES, INC.","Agilent Technologies, Inc. specializes in life sciences, diagnostics and applied markets, providing application-focused solutions that include instruments, software, services and consumables for the entire laboratory workflow. Its segments include Life Sciences and Diagnostics Markets, Agilent CrossLab and Applied Markets. Life Sciences and Diagnostics Markets segment comprises seven areas of activity. It offers active pharmaceutical ingredients for oligo-based therapeutics as well as solutions that include reagents, instruments, software and consumables. Agilent CrossLab segment offers a services and consumables portfolio that spans the entire lab, in addition to software and laboratory automation solutions, which are designed to enhance customer outcomes. Applied Markets segment offers application-focused solutions that include instruments and software that enable customers to identify, quantify and analyze the physical and biological properties of substances and products.",Healthcare Equipment & Supplies,USD,XNYS,Stock,41300338272.00,41300338272.00
AAPL,APPLE INC.,"Apple Inc. designs, manufactures and markets smartphones, personal computers, tablets, wearables and accessories, and sells a variety of related services. Its product categories include iPhone, Mac, iPad, and Wearables, Home and Accessories. Its software platforms include iOS, iPadOS, macOS, watchOS, visionOS, and tvOS. Its services include advertising, AppleCare, cloud services, digital content and payment services. The Company operates various platforms, including the App Store, that allow customers to discover and download applications and digital content, such as books, music, video, games and podcasts. It also offers digital content through subscription-based services, including Apple Arcade, Apple Fitness+, Apple Music, Apple News+, and Apple TV+. Its products include iPhone 16 Pro, iPhone 16, iPhone 15, iPhone 14, iPhone SE, MacBook Air, MacBook Pro, iMac, Mac mini, Mac Studio, Mac Pro, iPad Pro, iPad Air, AirPods, AirPods Pro, AirPods Max, Apple TV and Apple Vision Pro.","Computers, Phones & Household Electronics",USD,XNAS,Stock,3899609280299.00,3899609280299.00
ABBV,ABBVIE INC.,"AbbVie Inc. is a global, diversified research-based biopharmaceutical company. It is engaged in research and development, manufacturing, commercialization and sale of medicines and therapies. Its product portfolio includes Immunology, Oncology, Aesthetics, Neuroscience, Eye Care and Other Key Products. Immunology products include rheumatology, dermatology and gastroenterology. Oncology products include Imbruvica, Venclexta/Venclyxto, Elahere and Epkinly. Aesthetics portfolio consists of facial injectables, plastics and regenerative medicine, body contouring, and skincare products. Its Neuroscience products include Botox Therapeutic, Vraylar, Duopa and Duodopa, Ubrelvy, and Qulipta. Eye Care products include Ozurdex, Lumigan/Ganfort, Alphagan/Combigan, Restasis, and other eye care. Other key products include Mavyret/Maviret, Creon, and Linzess/Constella. Its investigational candidate, bretisilocin, is for the treatment of patients with moderate-to-severe major depressive disorder (MDD).",Pharmaceuticals,USD,XNYS,Stock,408675527720.00,408675527720.00
ABNB,"AIRBNB, INC.","Airbnb, Inc. operates a global platform for stays and experiences. The Company’s marketplace model connects hosts and guests online or through mobile devices to book spaces and experiences around the world. The Company has built its platform to onboard new hosts, especially those who previously had not considered hosting. It partners with hosts throughout the process of setting up their listing and provides them with a suite of tools to manage their listings, including scheduling, merchandising, integrated payments, community support, host protection, pricing guidance, and feedback from reviews. Its Website and mobile applications provide its guests with a way to explore a variety of homes and experiences and an easy way to book them. Its technology platform powers its two-sided marketplace and enables its global network of hosts and guests. It owns a trademark portfolio with protection in 220 countries in which it operates for its primary brands, AIRBNB, and its Belo logo.",Software & IT Services,USD,XNAS,Stock,79891773592.00,79891773592.00
ACGL,ARCH CAPITAL GROUP LTD.,"Arch Capital Group Ltd. is a Bermuda-based company, which provides insurance, reinsurance, and mortgage insurance through its subsidiaries. The insurance segment consists of the Company’s insurance underwriting units, which offer specialty product lines, including construction and national accounts; excess and surplus casualty; professional lines; programs; property, energy, marine and aviation; travel, accident and health; warranty and lender solutions, and others (consisting of alternative markets, excess workers' compensation and surety business). The reinsurance segment consists of its reinsurance underwriting units, which offer specialty product lines, including casualty; marine and aviation; other specialty; property catastrophe; property excluding property catastrophe, and others (consisting of life reinsurance and other). The mortgage segment includes its United States primary mortgage insurance business, investment and services related to United States credit-risk transfer.",Insurance,USD,XNAS,Stock,32731420310.00,32731420310.00
ACN,ACCENTURE PUBLIC LIMITED COMPANY,"Accenture plc is a global professional services company. It is engaged in providing a range of services and solutions across strategy and consulting, technology, operations, Industry X and Song. Its services include application services, artificial intelligence, automation, business process outsourcing, business strategy, change management, cloud, customer experience, data and analytics, ecosystem partners, finance consulting, Industry X, infrastructure, marketing, mergers and acquisitions, operating models, security, supply chain management, sustainability, technology consulting, technology innovation, and zero-based budgeting (ZBB). It specializes in the SAP business technology platform that designs digital products and experiences for enterprise customers, including custom portals and Web solutions and mobile applications. It provides clients with quantitative and qualitative risk management and compliance services. It specializes in advisory, management services and cybersecurity.",Software & IT Services,USD,XNYS,Stock,155397506256.00,155397506256.00
ADBE,ADOBE INC.,"Adobe Inc. is a global technology company. The Company's products, services and solutions are used around the world to imagine, create, manage, deliver, measure, optimize and engage with content across surfaces and fuel digital experiences. Its segments include Digital Media, Digital Experience, and Publishing and Advertising. The Digital Media segment is centered around Adobe Creative Cloud and Adobe Document Cloud, which include Adobe Express, Adobe Firefly, Photoshop and other products, offering a variety of tools for creative professionals, communicators and other consumers. The Digital Experience segment provides an integrated platform and set of products, services and solutions through Adobe Experience Cloud. The Publishing and Advertising segment contains legacy products and services. In addition, its Adobe GenStudio solution allows businesses to simplify their content supply chain process with generative artificial intelligence (AI) capabilities and intelligent automation.",Software & IT Services,USD,XNAS,Stock,149670430000.00,149670430000.00
ADI,"ANALOG DEVICES, INC.","Analog Devices, Inc. is a global semiconductor company. The Company designs, manufactures, tests, and markets a portfolio of solutions, including integrated circuits (ICs), software and subsystems that leverage high-performance analog, mixed-signal and digital signal processing technologies. Its comprehensive product portfolio, domain specialization and manufacturing capabilities extend across high-performance precision and high-speed mixed-signal, power management and processing technologies, including data converters, amplifiers, power management, radio frequency (RF) ICs, edge processors and other sensors. The Company's IC product portfolio includes both general-purpose products used by a range of customers and applications, as well as application-specific products designed for specific target markets. Its analog ICs monitor, condition, amplify or transform continuous analog signals associated with physical properties, such as temperature, pressure, weight, light, sound or motion.",Semiconductors & Semiconductor Equipment,USD,XNAS,Stock,121203051898.00,121203051898.00
ADM,ARCHER-DANIELS-MIDLAND COMPANY.,"Archer-Daniels-Midland Company is a global agricultural supply chain manager and processor, providing food security by connecting local needs with global capabilities. It is a human and animal nutrition provider. Its Ag Services and Oilseeds segment includes global activities related to the origination, merchandising, transportation, and storage of agricultural raw materials, and the crushing and further processing of oilseeds, such as soybeans and soft seeds into vegetable oils and protein meals. Carbohydrate Solutions segment is engaged in corn and wheat wet and dry milling and other activities. Nutrition segment is engaged in the creation, manufacturing, sale, and distribution of a wide array of ingredients and solutions, including plant-based proteins, flavors and colors derived from nature, flavor systems, emulsifiers, soluble fiber, polyols, hydrocolloids, probiotics, prebiotics, postbiotics, enzymes, botanical extracts, and other specialty food and feed ingredients and systems.",Food & Tobacco,USD,XNYS,Stock,29654268940.00,29654268940.00
ADSK,"AUTODESK, INC.","Autodesk, Inc. is engaged in three-dimensional (3D) design, engineering and entertainment technology solutions, spanning architecture, engineering, construction, product design, manufacturing, media and entertainment. Its architecture, engineering, construction and operations products improve the way building, infrastructure, and industrial projects are designed, built, and operated. Its product development and manufacturing software provides manufacturers in the automotive, transportation, industrial machinery, consumer products, and building product industries with comprehensive digital design, engineering, manufacturing, and production solutions. Its product offerings include AutoCAD Civil 3D, Autodesk Build, BIM Collaborate Pro, Revit, Tandem, AutoCAD, AutoCAD LT, Inventor, Vault, Maya, and 3ds Max. AutoCAD Civil 3D solution offers a surveying, design, analysis, and documentation solution for civil engineering, including land development, transportation, and environmental projects.",Software & IT Services,USD,XNAS,Stock,66151410000.00,66151410000.00
AEP,"AMERICAN ELECTRIC POWER COMPANY, INC.","American Electric Power Company, Inc. is an electric public utility holding company. Its electric utility operating companies provide generation, transmission and distribution services to more than five million retail customers in Arkansas, Indiana, Kentucky, Louisiana, Michigan, Ohio, Oklahoma, Tennessee, Texas, Virginia and West Virginia. Its segments include Vertically Integrated Utilities, Transmission and Distribution Utilities, AEP Transmission Holdco and Generation & Marketing. The Vertically Integrated Utilities is engaged in the generation, transmission and distribution of electricity for sale to retail and wholesale customers. The Transmission and Distribution Utilities consists of the transmission and distribution of electricity for sale to retail and wholesale customers. The AEP Transmission Holdco is engaged in development, construction and operation of transmission facilities. The Generation & Marketing segment conducts Marketing, risk management and retail activities.",Electrical Utilities & IPPs,USD,XNAS,Stock,62800941621.00,62800941621.00
AES,THE AES CORPORATION,"The AES Corporation is an energy company. The Company operates in four segments: Renewables, Utilities, Energy Infrastructure, and New Energy Technologies. The Renewables segment include solar, wind, energy storage, and hydro generation facilities. The Utilities segment includes AES Indiana, AES Ohio, and AES El Salvador regulated utilities and their generation facilities. The Energy Infrastructure segment includes natural gas, liquefied natural gas (LNG), coal, pet coke, diesel, and oil generation facilities, and its businesses in Chile, which have a mix of generation sources, including renewables. The New Energy Technologies segment includes investments in Fluence, Uplight, Maximo and other initiatives. It has two lines of business: Generation, which owns and/or operates power plants to generate and sell power to customers and Utilities that own and/or operate utilities to generate or purchase, distribute, transmit and sell electricity to end-user customers.",Electrical Utilities & IPPs,USD,XNYS,Stock,10253510000.00,10253510000.00
AFL,AFLAC INCORPORATED,"Aflac Incorporated provides financial protection to policyholders and customers through its subsidiaries in the United States and Japan. The Company’s principal business is supplemental health and life insurance products. The Company’s segments include Aflac Japan, which includes Aflac Life Insurance Japan (ALIJ), and Aflac U.S., which includes American Family Life Assurance Company of Columbus (Aflac), American Family Life Assurance Company of New York (Aflac New York), Continental American Insurance Company (CAIC), Tier One Insurance Company (TOIC) and Aflac Benefits Solutions, Inc. (ABS). The Aflac Japan segment is the insurer in Japan in terms of cancer and medical (third sector insurance products) policies in force. The Company designs its United States insurance products to provide supplemental coverage for people who already have major medical or primary insurance coverage, as Aflac U.S. insurance policies pay benefits regardless of other insurance.",Insurance,USD,XNYS,Stock,57858071670.00,57858071670.00
AIG,"AMERICAN INTERNATIONAL GROUP, INC.","American International Group, Inc. is a global insurance company. It provides insurance solutions that help businesses and individuals in over 200 countries and jurisdictions protect their assets and manage risks through its operations, licenses and authorizations and network partners. Its segment includes General Insurance and Other Operations. General Insurance business includes its three segments, including North America Commercial, International Commercial and Global Personal. The North America Commercial consists of insurance businesses in the United States, Canada and Bermuda. The International Commercial consists of insurance businesses in Japan, the United Kingdom, Europe, Middle East and Africa, Asia Pacific, Latin America and Caribbean and China. The North America and International Commercial segment products include property and short tail, casualty, financial lines and global specialty. Global Personal segment products include global accident and health and personal lines.",Insurance,USD,XNYS,Stock,43422817844.00,43422817844.00
AIZ,"ASSURANT, INC.","Assurant, Inc. is a global protection company that partners with various brands to safeguard and service connected devices, homes and automobiles. It utilizes data-driven technology solutions to provide customer experiences. It operates in North America, Latin America, Europe and Asia Pacific through two operating segments: Global Lifestyle and Global Housing. Global Lifestyle segment provides mobile device solutions, extended service contracts and related services for consumer electronics and appliances and credit and other insurance products (referred to as Connected Living), and vehicle protection services, commercial equipment services and other related services (referred to as Global Automotive). Global Housing segment provides lender-placed homeowners, manufactured housing and flood insurance, as well as voluntary manufactured housing, condominium and homeowners insurance (referred to as Homeowners), and renters insurance and other products (referred to as Renters and Other).",Insurance,USD,XNYS,Stock,10553540000.00,10553540000.00
AJG,ARTHUR J. GALLAGHER & CO.,"Arthur J. Gallagher & Co. is a global insurance brokerage, risk management and consulting services company. The Company’s segments include brokerage, risk management and corporate. The brokerage segment operations provide brokerage and consulting services to entities of all types, including commercial, nonprofit, public sector entities, insurance companies and insurance capital providers, and to a lesser extent, individuals, in the areas of insurance and reinsurance placements, risk of loss management, and management of employer- sponsored benefit programs. The risk management segment operations provide contract claim settlement, claim administration, loss control services and risk management consulting for commercial, non-profit, captive and public sector entities, and various other organizations that choose to self-insure property/casualty coverage or choose to use a third party claims management organization rather than the claim services provided by an underwriting enterprise.",Insurance,USD,XNYS,Stock,71520149740.00,71520149740.00
AKAM,"AKAMAI TECHNOLOGIES, INC.","Akamai Technologies, Inc. is a cybersecurity and cloud computing company. The Company develops and provides solutions for global enterprises to build, secure and accelerate their applications and digital experiences. Akamai Connected Cloud, the Company's platform, is comprised of an edge and cloud architecture and underlying network for cloud computing, security and content delivery services. Its cloud computing services include compute, storage, networking, database and container management services that are required to build, deploy and secure applications and workloads. Its security solutions are designed to keep infrastructure, websites, applications, application programming interfaces and users safe from a multitude of cyberattacks and online threats while improving performance. Its content delivery solutions consist of Web and mobile performance focused solutions and media delivery solutions. It also provides services and support for its customers as they utilize its solutions.",Software & IT Services,USD,XNAS,Stock,10646380000.00,10646380000.00
ALB,ALBEMARLE CORPORATION,"Albemarle Corporation is engaged in transforming essential resources into critical ingredients for mobility, energy, connectivity, and health. The Company’s segments include Energy Storage, Specialties, and Ketjen. The Energy Storage segment develops and manufactures a range of basic lithium compounds, including lithium carbonate, lithium hydroxide, and lithium chloride. Its Specialties business optimizes its portfolio of bromine and highly specialized lithium solutions. Its Specialties business serves a variety of industries, including energy, mobility, connectivity, and health. Specialty products are essential in both internal combustion and electric vehicles, from high-voltage cables and powertrains to airbags and tires. Its Ketjen segment includes clean fuels technologies (CFT), fluidized catalytic cracking (FCC) catalysts and additives, and performance catalyst solutions (PCS). It serves various markets such as grid storage, automotive, aerospace, conventional energy, and others.",Chemicals,USD,XNYS,Stock,11314040000.00,11314040000.00
ALGN,"ALIGN TECHNOLOGY, INC.","Align Technology, Inc. is a global medical device company that designs, manufactures, and sells the Invisalign system of clear aligners, iTero intraoral scanners, and exocad computer-aided design and computer-aided manufacturing (CAD/CAM) software for digital orthodontics and restorative dentistry. The Company provides Align Digital Platform. Its segments include Clear Aligner, and Imaging Systems and CAD/CAM Services (Systems and Services). The Clear Aligner segment consists of comprehensive products, non-comprehensive products and non-case products. Its comprehensive products include Invisalign Comprehensive and Invisalign First. The Company's non-case products include retention products, Invisalign training and adjusting tools. It offers up to four sets of custom clear aligners called Vivera retainers. The Systems and Services segment consists of its iTero intraoral scanning systems. Its services include subscription software, disposables, rentals, leases and pay per scan services.",Healthcare Equipment & Supplies,USD,XNAS,Stock,9874093321.00,9874093321.00
ALL,THE ALLSTATE CORPORATION,"The Allstate Corporation protects people from life’s uncertainties with a wide array of protection for autos, homes, electronic devices and identity theft. The Company’s products are available through Allstate agents, independent agents, major retailers, online and at the workplace. Its Allstate Protection segment offers private passenger auto, homeowners, other personal lines and commercial insurance. Its Run-off Property-Liability segment includes property and casualty insurance coverage. The Company’s Protection Services segment provides consumer product protection plans, device and mobile data collection services and analytic solutions using automotive telematics information, roadside assistance, protection and insurance products and identity protection and restoration through Allstate Protection Plans, Allstate Dealer Services, Allstate Roadside, Arity and Allstate Identity Protection.",Insurance,USD,XNYS,Stock,51051516822.00,51051516822.00
ALLE,ALLEGION PUBLIC LIMITED COMPANY,"Allegion plc is a global security products and solutions provider. The Company secures people and assets with a range of solutions for homes, businesses, schools and institutions. Its Allegion Americas segment is a provider of security products, services and solutions throughout North America. It sells a range of products and solutions, including locks, locksets, key systems, door controls and systems, exit devices, doors, accessories, electronic security products, access control systems and software and service solutions to customers in commercial, institutional, and residential facilities. Its Allegion International segment provides security products, services and solutions primarily throughout Europe, Asia and Oceania. The segment offers end-users a range of products, services and solutions, including locks, locksets, portable locks, key systems, door closers and systems, and others. Its brands include CISA, Interflex, LCN, Schlage, SimonsVoss, Von Duprin, Trimco and others.",Communications & Networking,USD,XNYS,Stock,15406874944.00,15406874944.00
AMAT,"APPLIED MATERIALS, INC.","Applied Materials, Inc. is a materials engineering solution company. The Company provides equipment, services and software to the semiconductor, display, and related industries. It operates in three segments: Semiconductor Systems, Applied Global Services (AGS), and Display. The Semiconductor systems segment designs, develops, manufactures and sells a range of primarily 300 mm equipment used to fabricate semiconductor chips, also referred to as integrated circuits (ICs). The AGS segment provides services, spares and factory automation software to customer fabrication plants globally. The AGS segment also manufactures and sells 200mm and other equipment. The Display segment is comprised primarily of products for manufacturing liquid crystal displays (LCDs), organic light-emitting diodes (OLEDs), and other display technologies for televisions, monitors, laptops, personal computers (PCs), tablets, smartphones, and other consumer-oriented devices.",Semiconductors & Semiconductor Equipment,USD,XNAS,Stock,180041205000.00,180041205000.00
AMCR,Amcor plc,"Amcor plc is engaged in packaging solutions for consumer and healthcare products. The Company develops sustainable packaging in flexible and rigid formats across multiple materials. The Company operates through two segments: Flexibles and Rigid Packaging. The Flexibles segment consists of operations that manufacture flexible and film packaging in the food and beverage, medical and pharmaceutical, fresh produce, snack food, personal care, and other industries. The Rigid Packaging segment consists of operations that manufacture rigid containers for a broad range of predominantly beverage and food products, including carbonated soft drinks, water, juices, sports drinks, milk-based beverages, spirits and wine, sauces, dressings, spreads and personal care items, and plastic caps for a wide variety of applications. The Company's subsidiaries include Berry Global Group Inc., Amcor Flexibles North America, Inc., Amcor UK Finance plc, Amcor Finance (USA), Inc., and others.",Containers & Packaging,USD,XNYS,Stock,18755425000.00,18755425000.00
