ticker,name,description,industry,currency,exchange,type,market_cap,market_cap_usd
IDXX,"IDEXX LABORATORIES, INC.","IDEXX Laboratories, Inc. develops, manufactures and distributes products and provides services primarily for the companion animal veterinary, livestock and poultry, dairy and water testing industries. The Company also provides human medical point-of-care and laboratory diagnostics. Its segments include Companion Animal Group (CAG), Water quality products (Water), and Livestock, Poultry and Dairy (LPD). The CAG segment offers diagnostic and information management-based products and services for the companion animal veterinary industry, including in-clinic diagnostic solutions, outside reference laboratory services, and veterinary software and services. The Water segment provides testing solutions for accurate detection and quantification of various microbiological parameters in water. The LPD segment provides diagnostic tests, services, and related instrumentation that are used to manage the health status of livestock and poultry, and to improve the quality and safety of milk.",Healthcare Equipment & Supplies,USD,XNAS,Stock,50973388139.00,50973388139.00
IEX,IDEX CORPORATION,"IDEX Corporation is a global applied solutions provider. The Company designs and builds engineered products and mission-critical components. Its segments include Fluid & Metering Technologies (FMT), Health & Science Technologies (HST) and Fire & Safety/Diversified Products (FSDP). The FMT segment designs, produces and distributes positive displacement pumps, valves, small volume provers, flow meters, injectors and other fluid-handling pump modules and systems and provides flow monitoring and other services. The HST segment designs, produces and distributes a range of precision fluidics, positive displacement pumps, powder and liquid processing technologies, drying systems, micro-precision components, pneumatic components and sealing solutions, and others. The FSDP segment designs, produces and distributes firefighting pumps, valves and controls, rescue tools, lifting bags and other components and systems; engineered stainless steel banding and clamping devices, and others.","Machinery, Equipment & Components",USD,XNYS,Stock,12748395122.00,12748395122.00
IFF,INTERNATIONAL FLAVORS & FRAGRANCES INC.,"International Flavors & Fragrances Inc. is a creator and manufacturer of food, beverage, health and biosciences, scent, and complementary adjacent products. The Company's segment includes Taste, Food Ingredients, Health & Biosciences, and Scent. The Taste segment consists of a range of flavor compounds and natural taste solutions used in food and beverage applications. The Food Ingredients segment includes a broad portfolio of natural and plant-based specialty ingredients that provide texturizing and food protection capabilities, as well as soy and pea protein solutions, emulsifiers, and sweeteners. Its Health & Biosciences segment consists of the development and production of an advanced biotechnology-derived portfolio of enzymes, food cultures, probiotics and specialty ingredients for food and non-food applications. Its Scent segment creates fragrance compounds and fragrance ingredients that are integral elements in perfumes and household and personal care products.",Food & Tobacco,USD,XNYS,Stock,16661224371.00,16661224371.00
INCY,INCYTE CORPORATION,"Incyte Corporation is a biopharmaceutical company, which is focused on the discovery, development, and commercialization of therapeutics. The Company operates in two therapeutic areas. One therapeutic area is Hematology/Oncology, which is comprised of Myeloproliferative Neoplasms and Graft-Versus-Host Disease, as well as solid tumors and hematologic malignancies. Its other therapeutic area is Inflammation and Autoimmunity, which includes its Dermatology commercial franchise. Its hematology and oncology franchise are comprised of six products, which are JAKAFI (ruxolitinib), MONJUVI (tafasitamab-cxix)/MINJUVI (tafasitamab), PEMAZYRE (pemigatinib), ICLUSIG (ponatinib), NIKTIMVO (axatilimab-csfr), and ZYNYZ (retifanlimab-dlwr), as well as numerous clinical development programs. The Company's pipeline also includes two first-in-class small molecule antagonist of Mas-related G protein-coupled receptor (MRGPRX2) and INCB000547, an oral MRGPRX4 antagonist.",Pharmaceuticals,USD,XNAS,Stock,17047612260.00,17047612260.00
INTC,INTEL CORPORATION,"Intel Corporation is a global designer and manufacturer of semiconductor products. The Company operates through three segments: Intel Products, Intel Foundry, and All Other. Its Intel Products segment includes Client Computing Group (CCG), Data Center and AI (DCAI), Network and Edge (NEX). The CCG is bringing together the operating system, system architecture, hardware, and software application integration to enable PC experiences. DCAI delivers workload-optimized solutions to cloud service providers and enterprises, along with silicon devices for communications service providers, network and edge, and HPC customers. NEX helps networks and edge compute systems from fixed-function hardware to general-purpose compute, acceleration, and networking devices running cloud native software on programmable hardware. The Intel Foundry segment comprises technology development, manufacturing and foundry services. All Other segments include Altera, Mobileye, Other.",Semiconductors & Semiconductor Equipment,USD,XNAS,Stock,178030387440.00,178030387440.00
INTU,INTUIT INC.,"Intuit Inc. offers a financial technology platform that helps consumers and small and mid-market businesses prosper by delivering financial management, compliance, and marketing products and services. It also provides specialized tax products to accounting professionals. Its offerings include TurboTax, Credit Karma, QuickBooks, and Mailchimp. Lacerte, ProSeries, and ProConnect Tax Online. Its Global Business Solutions segment serves small and mid-market businesses around the world, and the accounting professionals who assist and advise them. Its Consumer segment serves consumers and includes do-it-yourself and assisted TurboTax income tax preparation products and services sold in the United States and Canada. Its Credit Karma segment serves consumers with a personal finance platform that provides personalized recommendations for credit card, home, auto, and personal loan, and insurance products. Its ProTax segment serves professional accountants in the United States and Canada.",Financial Technology (Fintech) & Infrastructure,USD,XNAS,Stock,188204527200.00,188204527200.00
INVH,INVITATION HOMES INC.,"Invitation Homes Inc. is a real estate investment trust that conducts its operations through Invitation Homes Operating Partnership LP (INVH LP). INVH LP is engaged in owning, renovating, leasing, and operating single-family residential properties. Through THR Property Management L.P., a subsidiary of INVH LP, and its wholly owned subsidiaries (collectively, the Manager), it provides all management and other administrative services. The Manager provides professional property and asset management services to portfolio owners of single-family homes for lease. It has a vertically integrated operating platform that enables the Company to acquire, renovate, lease, maintain, and manage both the homes it owns and those it manages on behalf of others. Its business activity includes property operations, marketing and leasing, digital marketing initiatives and branding, resident relations and property maintenance, and investment and asset management. It has approximately 85,138 homes for lease.",Residential & Commercial REIT,USD,XNYS,Stock,17587205258.00,17587205258.00
IP,INTERNATIONAL PAPER COMPANY,"International Paper Company provides sustainable packaging solutions. The Company is a global producer of renewable fiber-based packaging and pulp products. Its segments include Packaging Solutions North America, Packaging Solutions EMEA and Global Cellulose Fibers. Packaging Solutions North America and Packaging Solutions EMEA segments are primarily focused on producing fiber-based packaging. It produces linerboard, medium, whitetop, recycled linerboard, recycled medium and saturating kraft of which a majority of its production is converted into corrugated packaging and other packaging. Global Cellulose Fibers segment primarily focuses on producing cellulose fibers which is a renewable raw material used in a variety of products people depend on every day such as diapers, towel and tissue products, feminine care, incontinence and other personal care products. Its specialty pulps serve as a sustainable raw material used in textiles, construction materials, paints, coatings and more.",Containers & Packaging,USD,XNYS,Stock,25174186528.00,25174186528.00
IPG,"THE INTERPUBLIC GROUP OF COMPANIES, INC.","The Interpublic Group of Companies, Inc. is a global advertising and marketing services company. The Company specializes in insights, data, media, creative and production, digital commerce, healthcare marketing and communications. It operates through three segments: Media, Data & Engagement Solutions (MD&E), Integrated Advertising & Creativity Led Solutions (IA&C), and Specialized Communications & Experiential Solutions (SC&E). The MD&E segment provides global media and communications services, digital services and products, advertising and marketing technology, e-commerce services, data management and analytics, strategic consulting, and digital brand experience. MD&E comprises IPG Mediabrands, Acxiom, and others. The IA&C segment provides advertising, corporate and brand identity services, and strategic consulting. The SC&E segment provides global public relations and other specialized communications services, events, sports and entertainment marketing, and strategic consulting.",Media & Publishing,USD,XNYS,Stock,9854161692.00,9854161692.00
IQV,IQVIA HOLDINGS INC,"IQVIA Holdings Inc. is a global provider of clinical research services, commercial insights and healthcare intelligence to the life sciences and healthcare industries. Its segments include Technology & Analytics Solutions, Research & Development Solutions and Contract Sales & Medical Solutions. The Technology & Analytics Solutions segment provides mission-critical information, technology solutions and real-world insights and services to the Company’s life science clients. The Research & Development Solutions segment primarily serves biopharmaceutical customers, and provides outsourced clinical research and clinical trial-related services. The Contract Sales & Medical Solutions segment provides healthcare provider (including contract sales) and patient engagement services to both biopharmaceutical customers and the broader healthcare market. It offers a set of strategic and implementation consulting services, including advanced analytics and commercial processes outsourcing services.",Biotechnology & Medical Research,USD,XNYS,Stock,37173900000.00,37173900000.00
IR,INGERSOLL RAND INC.,"Ingersoll Rand Inc. is a diversified, global provider of mission-critical flow creation products and industrial solutions. The Company offers a broad flow creation and industrial product portfolio across air, gas, powder, and liquid handling applications. It manufactures a range of compressor, pump, vacuum and blower products in its markets. Its Industrial Technologies and Services segment designs, manufactures, markets and services a range of air and gas compression, vacuum and blower products, fluid transfer equipment, loading systems, power tools and lifting equipment, including associated aftermarket parts, consumables and services. Its Precision and Science Technologies segment designs, manufactures and markets a range of highly specialized equipment for both industrial and life sciences markets. Its products are used for precision dosing, liquid and solid transfer, dispensing, gas compression, gas sampling, pressure management, flow control, and powder handling, amongst other.","Machinery, Equipment & Components",USD,XNYS,Stock,31625295424.00,31625295424.00
IRM,IRON MOUNTAIN INCORPORATED,"Iron Mountain Incorporated is a provider of information management services. The Company offers a range of services across digital transformation, information security, data center and asset lifecycle management (ALM) needs. The Company helps businesses to unlock value and intelligence from their stored digital and physical assets. It serves to protect its customers’ work. The Company operates through two segments: Global Records and Information Management (Global RIM) Business and Global Data Center Business. The Global RIM Business segment offers various offerings, including records management, data management, global digital solutions, secure shredding, entertainment services, and consumer storage. Its Global Data Center Business segment provides data center facilities and capacity to protect mission-critical assets and ensure the continued operation of its customers’ information technology (IT) infrastructure with flexible data center options.",Residential & Commercial REIT,USD,XNYS,Stock,30852072972.00,30852072972.00
ISRG,"INTUITIVE SURGICAL, INC.","Intuitive Surgical, Inc. develops, manufactures, and markets da Vinci surgical systems and the Ion endoluminal system. The Company specializes in invasive care and robotic-assisted surgery. Its technologies include the da Vinci surgical systems and the Ion endoluminal system. The da Vinci surgical system is designed to enable surgeons to perform a range of surgical procedures within its targeted general surgery, urologic, gynecologic, cardiothoracic, and head and neck specialties and consists of a surgeon's console or consoles, a patient-side cart, and a high-performance vision system. The Ion endoluminal system is a flexible, robotic-assisted, catheter-based platform for which the cleared indication is minimally invasive biopsies in the lung and consists of a system cart, a controller, a catheter, and a vision probe. Its Ion system extends its commercial offering beyond surgery into diagnostic and endoluminal procedures.",Healthcare Equipment & Supplies,USD,XNAS,Stock,165881415610.00,165881415610.00
IT,"GARTNER, INC.","Gartner, Inc. delivers actionable, objective insight to executives and their teams. It operates through three segments: Research, Conferences and Consulting. The Research segment delivers independent, objective insight to leaders across an enterprise through subscription services that include on-demand access to published research content, data and benchmarks, and direct access to a network of research experts located around the globe. The Gartner Conferences segment is designed for information technology (IT) and business executives as well as decision-makers looking to adapt and evolve their organizations through disruption and uncertainty, navigate risks and prioritize investments. The Consulting segment serves chief information officers and other senior executives to optimize technology investments and drive business impact. The Company also provides solutions for a range of IT-related priorities, including IT cost optimization, digital transformation, and IT sourcing optimization.",Software & IT Services,USD,XNYS,Stock,19548922114.00,19548922114.00
ITW,ILLINOIS TOOL WORKS INC.,"Illinois Tool Works Inc. is a global manufacturer of a diversified range of industrial products and equipment. The Company's segments include Automotive OEM; Food Equipment; Test & Measurement and Electronics; Welding; Polymers & Fluids; Construction Products, and Specialty Products. The Automotive OEM segment produces components and fasteners for automotive-related applications. The Food Equipment segment produces warewashing equipment, cooking equipment, refrigeration equipment, food processing equipment, ventilation and pollution control systems, and others. Its Welding segment produces arc welding equipment and metal arc welding consumables and related accessories. The Construction segment is a supplier of engineered fastening systems and solutions. The Specialty Products segment includes conveyor systems and line automation for the food and beverage industries; plastic consumables such as multipack cans and bottles and related equipment; components for medical devices, and others.",Consumer Goods Conglomerates,USD,XNYS,Stock,74956310000.00,74956310000.00
IVZ,INVESCO LTD,"Invesco Ltd. is an independent investment management firm. It serves the retail and institutional markets within the investment management industry in the Americas, Europe, Middle East, and Africa and Asia-Pacific in 120 countries. It offers a range of investment strategies across asset classes, investment styles, and geographies. Its asset classes include equity, fixed income, balanced, alternatives and money market. Its retail assets under management include exchange-traded funds, separately managed accounts, individual savings accounts, investment companies with variable capital, investment trusts, open-end mutual funds, unit investment trusts, and variable insurance funds. Its institutional assets include institutional separate accounts, private funds, open-end mutual funds, and collective trust funds. Its client base includes public and private entities, unions, non-profit organizations, endowments, foundations, financial institutions, and sovereign wealth funds.",Investment Banking & Investment Services,USD,XNYS,Stock,10230409572.00,10230409572.00
J,JACOBS SOLUTIONS INC.,"Jacobs Solutions Inc. provides end-to-end services in advanced manufacturing, cities and places, energy, environmental, life sciences, transportation and water. The Company’s segments include Infrastructure and Advanced Facilities (I&AF) and PA Consulting. The I&AF segment provides end-to-end solutions for its client’s complex challenges related to climate change, energy transition, connected mobility, buildings and infrastructure, integrated water management and biopharmaceutical manufacturing. It uses data science and technology-enabled expertise to deliver outcomes for its clients and communities. Its clients include national, state and local governments in Europe, the Middle East, and others. The PA Consulting segment has a diverse mix of private and public sector clients. Private sector clients include global household names like Unilever, Microsoft, and Pret A Manger, and start-ups like PulPac, which converts plant fibers into sustainable packaging to reduce single-use plastic.",Professional & Commercial Services,USD,XNYS,Stock,19433040000.00,19433040000.00
JBHT,"J. B. HUNT TRANSPORT SERVICES, INC.","J.B. Hunt Transport Services, Inc. is a surface transportation, delivery, and logistics company in North America. The Company, through its wholly owned subsidiaries, provides a range of transportation, brokerage, and delivery services to a diverse group of customers and consumers throughout the continental United States, Canada, and Mexico. It operates through five segments: Intermodal (JBI), Dedicated Contract Services (DCS), Integrated Capacity Solutions (ICS), Final Mile Services (FMS) and Truckload (JBT). JBI segment includes freight that is transported by rail over at least some portion of the movement and also includes certain repositioning truck freight moved by JBI equipment or third-party carriers. DCS segment focuses on private fleet conversion and creation of replenishment and specialized equipment. ICS segment provides non-asset and asset-light transportation solutions to customers through relationships with third-party carriers and integration with Company-owned equipment.",Freight & Logistics Services,USD,XNAS,Stock,16089937639.00,16089937639.00
JBL,JABIL INC.,"Jabil Inc. provides comprehensive engineering, manufacturing, and supply chain solutions. The Company provides comprehensive electronics design, production, and product management services to companies in various industries and end markets. The Company’s Regulated Industries segment is focused on regulated markets and includes revenues from customers primarily in the automotive and transportation, healthcare and packaging, and renewable energy infrastructure industries. Its Intelligent Infrastructure segment is focused on the modern digital ecosystem including artificial intelligence (AI) infrastructure and includes revenues from customers primarily in the capital equipment, cloud and data center infrastructure, and networking and communications industries. Its Connected Living and Digital Commerce segment is focused on digitalization and automation, including warehouse automation and robotics. The Company is also engaged in drug development and manufacturing solutions.",Electronic Equipment & Parts,USD,XNYS,Stock,21486049403.00,21486049403.00
JCI,JOHNSON CONTROLS INTERNATIONAL PUBLIC LIMITED COMPANY,"Johnson Controls International plc specializes in smart buildings, offering a portfolio of building technology, software and services. The Company's segments include Americas, EMEA and APAC. The Company is engaged in engineering, manufacturing, commissioning and retrofitting building products and systems, including residential and commercial heating, ventilating, air-conditioning (HVAC) equipment, industrial refrigeration systems, controls, security systems, fire-detection systems and fire-suppression solutions. The Company also serves customers by providing technical services, including maintenance, management, repair, retrofit and replacement of equipment (in the HVAC, industrial refrigeration, controls, security and fire-protection space) and energy-management consulting. Its OpenBlue digital software platform enables enterprises to manage their physical spaces. The Company serves various industries, including healthcare, schools, data centers, airports, stadiums and manufacturing.","Machinery, Equipment & Components",USD,XNYS,Stock,72754568772.00,72754568772.00
JKHY,"JACK HENRY & ASSOCIATES, INC.","Jack Henry & Associates, Inc. is a financial technology company. The Company’s segments include Core, Payments, Complementary, and Corporate and Other. The Core segment provides core information processing platforms to banks and credit unions, which consist of integrated applications required to process deposit, loan, and general ledger transactions, and maintain centralized customer/member information. The Payments segment provides secure payment processing tools and services, including automated teller machine, debit, and credit card processing services; online and mobile bill pay solutions; automated clearinghouse origination and remote deposit capture processing; and risk management products and services. The Complementary segment provides additional software, hosted processing platforms, and services, including digital/mobile banking, treasury services, online account opening, fraud/anti-money laundering and lending/deposit solutions that can be integrated with its core solutions.",Software & IT Services,USD,XNAS,Stock,11402623184.00,11402623184.00
JNJ,JOHNSON & JOHNSON,"Johnson & Johnson and its subsidiaries are engaged in the research and development, manufacture, and sale of a range of products in the healthcare field. The Company’s segments include Innovative Medicine and MedTech. The Innovative Medicine segment is focused on various therapeutic areas, including immunology, infectious diseases, neuroscience, oncology, pulmonary hypertension, cardiovascular and metabolism. Its products include REMICADE (infliximab), SIMPONI (golimumab), SIMPONI ARIA (golimumab), STELARA (ustekinumab), TREMFYA (guselkumab), EDURANT (rilpivirine), and INVEGA SUSTENNA/XEPLION (paliperidone palmitate). The MedTech segment includes a portfolio of products used in cardiovascular, orthopedics, surgery, and vision categories. The Cardiovascular portfolio includes electrophysiology products to treat heart rhythm disorders and circulatory restoration products (Shockwave) for the treatment of calcified coronary artery disease (CAD) and peripheral artery disease (PAD).",Pharmaceuticals,USD,XNYS,Stock,462124129015.00,462124129015.00
JPM,JPMORGAN CHASE & CO.,"JPMorgan Chase & Co. is a financial holding company. The Company is engaged in investment banking, financial services for consumers and small businesses, commercial banking, financial transaction processing and asset management. The Company operates through three segments: Consumer & Community Banking (CCB), Commercial & Investment Bank (CIB), and Asset & Wealth Management (AWM). Its CCB segment offers products and services to consumers and small businesses through bank branches, ATMs, digital and telephone banking. Its CIB segment consists of banking and payments and markets and securities services, and offers a suite of investment banking, lending, payments, market-making, financing, custody and securities products and services to a global base of corporate and institutional clients. AWM segment offers investment and wealth management solutions. It offers multi-asset investment management solutions, retirement products and services, brokerage, custody, estate planning, and others.",Banking Services,USD,XNYS,Stock,816924415859.00,816924415859.00
