ticker,name,description,industry,currency,exchange,type,market_cap,market_cap_usd
PODD,INSULET CORPORATION,"Insulet Corporation is a medical device company. It is primarily engaged in the development, manufacture and sale of its continuous insulin delivery systems for people with insulin-dependent diabetes. The Omnipod System includes the Omnipod 5 Automated Insulin Delivery System (Omnipod 5), the Omnipod DASH Insulin Management System, and the Omnipod Insulin Management System. The Omnipod platform offers continuous insulin delivery that provides various benefits of insulin pump therapy in a way without the need for external tubing required with conventional pumps. The small, lightweight, self-adhesive disposable tubeless Omnipod device (Pod), can be worn in multiple locations, including the abdomen, hip, back of upper arm, upper thigh, or lower back, and delivers insulin into the body through a small flexible tube. It also produces pods for Amgen for use in the Neulasta Onpro kit, a delivery system for Amgen’s Neulasta to help reduce the risk of infection after intense chemotherapy.",Healthcare Equipment & Supplies,USD,XNAS,Stock,23157030594.00,23157030594.00
POOL,POOL CORPORATION,"Pool Corporation is a wholesale distributor of swimming pool supplies, equipment, and related leisure products. The Company also distributes irrigation and landscape products in the United States. The Company operates approximately 448 sales centers in North America, Europe, and Australia through its five distribution networks: SCP Distributors (SCP), Superior Pool Products (Superior), Horizon Distributors (Horizon), National Pool Tile (NPT), and Sun Wholesale Supply (Sun Wholesale). The Company distributes swimming pool supplies, equipment, and related leisure products domestically through its SCP and Superior sales center networks through SCP network. Its Horizon sales centers offer organic fertilizers, organic pesticides, and irrigation and drainage products that reduce water usage and soil erosion. Sun Wholesale distributes swimming pool supplies, equipment, and related leisure products, primarily servicing independently owned and operated Pinch A Penny, Inc. franchise locations.",Leisure Products,USD,XNAS,Stock,11293549366.00,11293549366.00
PPG,"PPG INDUSTRIES, INC.","PPG Industries, Inc. manufactures and distributes a broad range of paints, coatings and specialty products. Its segments include Global Architectural Coatings, Performance Coatings and Industrial Coatings. The Global Architectural Coatings segment consists of architectural coatings EMEA and architectural coatings Latin America and Asia Pacific operating segments. This segment primarily supplies paints, wood stains, adhesives, sealants and purchased sundries. The Performance Coatings segment consists of automotive refinish coatings, aerospace coatings, protective and marine coatings and traffic solutions operating segments. This segment primarily supplies a variety of coatings, solvents, adhesives, sealants, foams and finishes, along with pavement marking products, transparencies and paint films. The Industrial Coatings segment supplies a variety of protective and decorative coatings and finishes along with adhesives, sealants, metal pretreatment products, and other specialty products.",Chemicals,USD,XNYS,Stock,23565337000.00,23565337000.00
PPL,PPL CORPORATION,"PPL Corporation is an energy company. The Company is focused on providing electricity and natural gas in the United States. The Company operates through three segments: Kentucky Regulated, Pennsylvania Regulated, and Rhode Island Regulated. The Kentucky Regulated segment consists primarily of the regulated electricity generation, transmission and distribution operations conducted by Louisville Gas & Electric Company (LG&E) and Kentucky Utilities Company (KU), as well as LG&E's regulated distribution and sale of natural gas. LG&E and KU are engaged in the regulated generation, transmission, distribution and sale of electricity in Kentucky and, in KU's case, also Virginia. The Pennsylvania Regulated segment includes the regulated electricity transmission and distribution operations of PPL Electric. The Rhode Island Regulated segment includes the regulated electricity transmission and distribution operations and regulated distribution and sale of natural gas conducted by RIE.",Multiline Utilities,USD,XNYS,Stock,27746614056.00,27746614056.00
PSA,PUBLIC STORAGE.,"Public Storage is a real estate investment trust. Its principal business activities include the ownership and operation of self-storage facilities that offer storage spaces for lease, generally on a month-to-month basis, for personal and business use, and other related operations, such as tenant reinsurance, merchandise sales, third party management, and bridge lending to third-party self-storage owners, as well as the acquisition and development of additional self-storage space. Its Self-Storage Operations segment includes the aggregated rental operations from the self-storage facilities it owns from same store facilities, acquired facilities, newly developed and expanded facilities, and other non-same store facilities. Its Ancillary Operations segment includes the combined operations of its tenant reinsurance, merchandise sales, and third-party property management operating segments. It owned interests in over 3,085 self-storage facilities located in 40 states in the United States.",Residential & Commercial REIT,USD,XNYS,Stock,54086865483.00,54086865483.00
PSX,PHILLIPS 66,"Phillips 66 is a diversified and integrated downstream energy provider that manufactures, transports and markets products. The Company's Midstream segment provides crude oil and refined petroleum product transportation, terminating and processing services, as well as natural gas and natural gas liquids (NGL) transportation, storage, fractionation, gathering, processing and marketing services. Its Chemicals segment consists of its 50% equity investment in Chevron Phillips Chemical Company LLC, which manufactures and markets petrochemicals and plastics on a worldwide basis. Its Refining segment refines crude oil and other feedstocks into petroleum products, such as gasoline, distillates, including aviation fuels. Its Marketing and Specialties segment purchases for resale and markets refined products, mainly in the United States and Europe. Its Renewable Fuels segment processes renewable feedstocks into renewable products at the Rodeo Renewable Energy Complex and at its Humber Refinery.",Oil & Gas,USD,XNYS,Stock,51970384980.00,51970384980.00
1GLW,CORNING INCORPORATED,"Corning Incorporated operates as an innovator in materials science. Its segments include Optical Communications, Display Technologies, Specialty Materials, Environmental Technologies, and Life Sciences. Its Optical Communications segment manufactures carrier network and enterprise network components for the telecommunications industry. Its Display Technologies segment manufactures glass substrates for flat-panel displays, including liquid crystal displays and organic light-emitting diodes. Its Specialty Materials segment manufactures products that provide material formulations for glass, glass ceramics and fluoride crystals for customer needs. Its Environmental Technologies segment manufactures ceramic substrates and filters for emission control systems in mobile applications. Its Life Sciences segment develops, manufactures and supplies laboratory products, including labware, equipment, media, serum and reagents, enabling workflow solutions for drug discovery and bioproduction.",Electronic Equipment & Parts,EUR,XMIL,Stock,73052450000.00,84806589205.00
PWR,"QUANTA SERVICES, INC.","Quanta Services, Inc. provides specialized infrastructure solutions to the utility, renewable energy, technology, communications, pipeline, and energy industries in the United States, Canada, Australia and other international markets. Its segments include Electric Infrastructure Solutions (Electric) and Underground Utility and Infrastructure Solutions (Underground and Infrastructure). Electric provides comprehensive services for electric power, renewable energy, technology and communications markets. Services include design, procurement, new construction, upgrade and repair and maintenance services for electric power transmission and distribution infrastructure, both overhead and underground, and substation facilities, along with other engineering and technical services. The Underground and Infrastructure provides comprehensive infrastructure solutions to customers involved in the transportation, distribution, storage, development and processing of natural gas, oil and other products.",Construction & Engineering,USD,XNYS,Stock,65200511663.00,65200511663.00
PYPL,"PAYPAL HOLDINGS, INC.","PayPal Holdings, Inc. offers a technology platform. The Company’s products are designed to enable digital payments and simplify commerce experiences for consumers and merchants to make selling, shopping, and sending and receiving money simple, personalized, and secure, online or offline, including mobile. It provides consumers with a digital wallet that enables them to send payments to merchants securely using a variety of funding sources, which include a bank account, a PayPal or Venmo account balance, its consumer credit products, a credit card, a debit card, certain cryptocurrencies, or other stored value products. It operates a global, two-sided network at scale that connects consumers and merchants with 434 million active accounts across approximately 200 markets. Its brands include PayPal, Braintree, Venmo, Xoom, Hyperwallet, PayPal Zettle, PayPal Honey, and Paidy. It offers financing products through the PayPal Working Capital (PPWC) and PayPal Business Loan (PPBL).",Professional & Commercial Services,USD,XNAS,Stock,66924256920.00,66924256920.00
QCOM,QUALCOMM INCORPORATED,"Qualcomm Incorporated is engaged in the development and commercialization of foundational technologies for the wireless industry, including third generation (3G), fourth generation (4G) and fifth generation (5G) wireless connectivity, and high-performance and low-power computing, including on-device artificial intelligence. Its segments include Qualcomm CDMA Technologies (QCT), Qualcomm Technology Licensing (QTL) and Qualcomm Strategic Initiatives. QCT develops and supplies integrated circuits and system software based on 3G/4G/5G and other technologies, including radio frequency front-end, digital cockpit and advanced driver assistance and automated driving, Internet of things including consumer electronic devices, industrial devices and edge networking products. QTL grants licenses or otherwise provides rights to use portions of its intellectual property portfolio that includes certain patent rights essential to and/or useful in the manufacture and sale of certain wireless products.",Semiconductors & Semiconductor Equipment,USD,XNAS,Stock,181964974000.00,181964974000.00
RCL,ROYAL CARIBBEAN CRUISES LTD.,"Royal Caribbean Cruises Ltd. is a cruise company, which owns and operates three global cruise brands: Royal Caribbean International, Celebrity Cruises and Silversea Cruises. It also has an interest in TUI Cruises GmbH, which operates the German brands TUI Cruises and Hapag-Lloyd Cruises. Its ships offer a selection of worldwide itineraries that call on approximately 1,000 destinations on all seven continents. Royal Caribbean International offers cruises and land destinations that generally feature a casual ambiance, as well as a variety of activities and entertainment venues. Celebrity Cruises offers a range of itineraries to destinations, including Alaska, Asia, Australia, Bermuda, Canada, the Caribbean, Europe, the Galapagos Islands, Hawaii, New Zealand, the Panama Canal and South America, with cruise lengths ranging from three to 14 nights. It also offers a range of private land destinations through Perfect Day at CocoCay, includes full water park, zip line course, and others.",Hotels & Entertainment Services,USD,XNYS,Stock,86067953022.00,86067953022.00
REG,REGENCY CENTERS CORPORATION,"Regency Centers Corporation is a fully integrated real estate company and a self-administered and self-managed real estate investment trust. The Company conducts all its operations through Regency Centers, L.P. (the Operating Partnership). It is engaged in acquiring, developing, owning, and operating income-producing retail real estate principally located in suburban trade areas with compelling demographics within the United States. Its portfolio comprises approximately 488 properties. Its properties include Amerige Heights Town Center, Friars Mission Center, Navajo Shopping Center, Point Loma Plaza, Rancho San Diego Village, Scripps Ranch Marketplace, The Hub Hillcrest Market, Twin Peaks, 200 Potrero, Bayhill Shopping Center, Clayton Valley Shopping Center, Diablo Plaza, Encina Grande, Plaza Escuela, Pleasant Hill Shopping Center, Potrero Center, Corral Hollow, Serramonte Center, Bridgepark Plaza, Mercantile West, Mercantile East, Terrace Shops, Sendero Marketplace and others.",Residential & Commercial REIT,USD,XNAS,Stock,13100886128.00,13100886128.00
REGN,"REGENERON PHARMACEUTICALS, INC.","Regeneron Pharmaceuticals, Inc. is a fully integrated biotechnology company. The Company invents, develops, manufactures, and commercializes medicines for people with serious diseases. Its products and product candidates in development are designed to help patients with eye diseases, allergic and inflammatory diseases, cancer, cardiovascular and metabolic diseases, neurological diseases, hematologic conditions, infectious diseases, and rare diseases. The Company is accelerating drug development using its proprietary technologies, such as VelociSuite, which produces optimized fully human antibodies and new classes of bispecific antibodies. VelociSuite consists of VelocImmune, VelociGene, VelociMouse, VelociMab, Veloci-Bi, VelociT, VelociHum, and other related technologies. Its marketed products include EYLEA (aflibercept); Dupixent (dupilumab); Libtayo (cemiplimab); Ordspono (odronextamab); Kevzara (sarilumab); Itepekimab; Linvoseltamab, and others.",Pharmaceuticals,USD,XNAS,Stock,61130380000.00,61130380000.00
RF,REGIONS FINANCIAL CORPORATION,"Regions Financial Corporation is a full-service provider of consumer and commercial banking, wealth management, and mortgage products and services. It serves customers across the South, Midwest and Texas, and through its subsidiary, Regions Bank, operates approximately 1,250 banking offices and more than 2,000 ATMs. Its segments include Corporate Bank, Consumer Bank and Wealth Management. The Corporate Bank segment represents its commercial banking functions, including commercial and industrial, commercial real estate and investor real estate lending. The Consumer Bank segment represents its branch network, including consumer banking products and services related to residential first mortgages, home equity lines and loans, consumer credit cards and other consumer loans, as well as the corresponding deposit relationships. The Wealth Management segment offers credit-related products, trust and investment management, asset management, retirement and savings solutions and estate planning.",Banking Services,USD,XNYS,Stock,21558600000.00,21558600000.00
RJF,"RAYMOND JAMES FINANCIAL, INC.","Raymond James Financial, Inc. is a diversified financial services company that provides services to individuals, corporations and municipalities. The Company's segments include Private Client Group (PCG), Capital Markets, Asset Management, Bank and Other. PCG segment provides financial planning, investment advisory, and securities transaction services to clients through financial advisors. Capital Markets segment conducts investment banking, institutional sales, securities trading, equity research, and the syndication and management of investments in low-income housing funds and funds of a similar nature. Asset Management segment provides asset management, portfolio management and related administrative services to retail and institutional clients. Bank segment includes Raymond James Bank, a Florida-chartered state member bank, and TriState Capital Bank, a Pennsylvania-chartered state member bank. Other segment includes corporate cash balances and its private equity investments.",Investment Banking & Investment Services,USD,XNYS,Stock,33047898000.00,33047898000.00
RL,RALPH LAUREN CORPORATION,"Ralph Lauren Corporation is engaged in the design, marketing, and distribution of luxury lifestyle products, including apparel, footwear and accessories, home, fragrances and hospitality. Its segments include North America, Europe, and Asia. Its brands include Ralph Lauren, Ralph Lauren Collection, Ralph Lauren Purple Label, Polo Ralph Lauren, Lauren Ralph Lauren, Polo Ralph Lauren Children, and Chaps, among others. Its products include apparel and footwear and accessories for men, women, and children, as well as fragrance and home collections, together with its hospitality portfolio. Its range of footwear and accessories include casual shoes, dress shoes, boots, sneakers, sandals, eyewear, watches, scarves, hats and others. Its range of home products includes bed and bath lines, lighting, dining, floor coverings, giftware and more. Its hospitality collection is comprised of its restaurants, including The Polo Bar in New York City, RL Restaurant located in Chicago, and others.",Textiles & Apparel,USD,XNYS,Stock,20291172314.00,20291172314.00
RMD,RESMED INC.,"ResMed Inc. is a holding company. The Company, through its subsidiaries, in the development, manufacturing, distribution and marketing of medical devices and cloud-based software applications that diagnose, treat and manage respiratory disorders, including sleep disordered breathing (SDB), chronic obstructive pulmonary disease, neuromuscular disease and other chronic diseases. Its segments include Sleep and Breathing Health segment and the Residential Care Software segment. It also operates a Software as a Service (SaaS) business in the United States and Germany that includes out-of-hospital software platforms designed to support the professionals and caregivers who help people stay healthy in the home or care setting of their choice. Its products and solutions are designed to improve patients' quality of life and reduce the impact of chronic disease. Its cloud-based digital health software applications, along with its devices, are designed to provide connected care.",Healthcare Equipment & Supplies,USD,XNYS,Stock,39144214554.00,39144214554.00
LIN,LINDE PUBLIC LIMITED COMPANY,"Linde plc is a United Kingdom-based industrial gases and engineering company. The Company serves a variety of end markets, such as chemicals and energy, food and beverage, electronics, healthcare, manufacturing, metals, and mining. The Company’s industrial gases and technologies are used in countless applications, including production of clean hydrogen and carbon capture systems critical to the energy transition, life-saving medical oxygen and high-purity and specialty gases for electronics. It also delivers gas processing solutions to support customer expansion, efficiency improvements and emissions reductions. Its primary products in its industrial gases business are atmospheric gases and process gases. The Company also designs and builds equipment that produces industrial gases and offers customers a range of gas production and processing services, such as olefin plants, natural gas plants, air separation plants, hydrogen and synthesis gas plants and other types of plants.",Chemicals,EUR,XETR,Stock,211740800000.00,245809894720.00
ROL,"ROLLINS, INC.","Rollins, Inc. is a global consumer and commercial services company. The Company provides essential pest and wildlife control services and protection against termite damage, rodents, and insects to both residential and commercial customers through its subsidiaries and independent franchises located in over 70 countries, including in the United States, Canada, Australia, Europe, and Asia with international franchises in Canada, Central and South America, and others. It operates under one segment, including its three service offerings: Residential service includes pest control services protecting residential properties from common pests, including rodents, insects, and wildlife; Commercial services consist of workplace pest control solutions for customers across diverse end markets, such as healthcare, food service, and logistics, and Termite and Ancillary services offer termite protection services and ancillary services for both residential and commercial customers.",Professional & Commercial Services,USD,XNYS,Stock,27299771200.00,27299771200.00
ROP,"ROPER TECHNOLOGIES, INC.","Roper Technologies, Inc. is a diversified technology company. It operates businesses that design and develop vertical software and technology-enabled products for a variety of defensible niche markets. The Company operates through three segments: Application Software, Network Software and Technology Enabled Products. The Application Software segment includes Aderant, Clinisys, Data Innovations, Deltek, Frontline, IntelliTrans, PowerPlan, Procare, Strata, Transact/CBORD, and Vertafore. The Network Software segment includes ConstructConnect, DAT, Foundry, iPipeline, iTradeNetwork, Loadlink, MHA, SHP, and SoftWriters. The Technology Enabled Products segment includes CIVCO Medical Solutions, FMI, Inovonics, IPA, Neptune, Northern Digital, rf IDEAS, and Verathon. Aderant is a comprehensive management software solution for law and other professional services firms. Data Innovations is a software solution that enables the enterprise management of hospitals and independent laboratories.",Software & IT Services,USD,XNAS,Stock,55369452376.00,55369452376.00
ROST,"ROSS STORES, INC.","Ross Stores, Inc. is engaged in operating two brands of off-price retail apparel and home fashion stores-Ross Dress for Less (Ross) and dds DISCOUNTS. Ross is the off-price apparel and home fashion chain in the United States, with approximately 1,831 locations in 43 states, the District of Columbia, and Guam. Ross offers in-season, name brand and designer apparel, accessories, footwear, and home fashions for the entire family at savings of 20% to 60% off department and specialty store regular prices every day. Ross target customers are primarily from middle-income households. It also operates approximately 355 dds DISCOUNTS stores in 22 states. dds DISCOUNTS features more moderately-priced in- season, name brand apparel, accessories, footwear, and home fashions for the entire family at savings of 20% to 70% off moderate department and discount store regular prices every day. It operates a total of approximately 2,186 stores.",Specialty Retailers,USD,XNAS,Stock,50868645583.00,50868645583.00
RSG,"REPUBLIC SERVICES, INC.","Republic Services, Inc. provides environmental services in the United States. It provides recycling, solid waste, special waste, hazardous waste and field services. Its segments include Group 1, Group 2 and Group 3. Group 1 is its recycling and waste business operating primarily in geographic areas located in the western United States. Group 2 is its recycling and waste business operating primarily in geographic areas located in the southeastern and mid-western United States, the eastern seaboard of the United States, and Canada. Group 3 is its environmental solutions business operating primarily in geographic areas located across the United States and Canada. It operates across the United States and Canada through 367 collection operations, 248 transfer stations, 75 recycling centers, 208 active landfills, two treatment, recovery and disposal facilities, 23 treatment, storage and disposal facilities, five saltwater disposal wells, 14 deep injection wells and one polymer center.",Professional & Commercial Services,USD,XNYS,Stock,68980958852.00,68980958852.00
RTX,RTX CORPORATION,"RTX Corporation is an aerospace and defense company, which provides advanced systems and services for commercial, military, and government customers worldwide. The Company operates through three segments: Collins Aerospace, Pratt & Whitney, and Raytheon. Collins Aerospace segment provides technologically advanced aerospace and defense products and aftermarket service solutions for civil and military aircraft manufacturers, commercial airlines, and regional, business and general aviation, as well as for defense and commercial space operations. The Pratt & Whitney segment supplies aircraft engines for commercial, military, business jet, and general aviation customers. The Raytheon segment provides defensive and offensive threat detection, tracking and mitigation capabilities for the United States and foreign government and commercial customers. The Raytheon designs, develops, and provides advanced capabilities in integrated air and missile defense, smart weapons, missiles and others.",Aerospace & Defense,USD,XNYS,Stock,231540995160.00,231540995160.00
